"Ebene";"EDV-Code";"Code";"Titel";"korrespondierende Ebene";"korrespondierender EDV-Code";"korrespondierender Code";"korrespondierender Titel";"Korrespondenz-Beschreibung"
5;"G46170";"G 46.17-0";"Tätigkeiten der Großhandelsvermittlung von Nahrungsmitteln, Getränken und Tabakwaren";4;"G4617";"G 46.17";"Tätigkeiten der Großhandelsvermittlung von Nahrungsmitteln, Getränken und Tabakwaren";""
5;"G46180";"G 46.18-0";"Tätigkeiten der Großhandelsvermittlung von sonstigen Waren";4;"G4618";"G 46.18";"Tätigkeiten der Großhandelsvermittlung von sonstigen Waren";""
5;"G46190";"G 46.19-0";"Tätigkeiten der Großhandelsvermittlung von Waren ohne ausgeprägten Schwerpunkt";4;"G4619";"G 46.19";"Tätigkeiten der Großhandelsvermittlung von Waren ohne ausgeprägten Schwerpunkt";""
5;"G46210";"G 46.21-0";"Großhandel mit Getreide, Rohtabak, Saatgut und Futtermitteln";4;"G4621";"G 46.21";"Großhandel mit Getreide, Rohtabak, Saatgut und Futtermitteln";""
5;"G46220";"G 46.22-0";"Großhandel mit Blumen und Pflanzen";4;"G4622";"G 46.22";"Großhandel mit Blumen und Pflanzen";""
5;"G46230";"G 46.23-0";"Großhandel mit lebenden Tieren";4;"G4623";"G 46.23";"Großhandel mit lebenden Tieren";""
5;"G46240";"G 46.24-0";"Großhandel mit Häuten, Fellen und Leder";4;"G4624";"G 46.24";"Großhandel mit Häuten, Fellen und Leder";""
5;"G46310";"G 46.31-0";"Großhandel mit Obst, Gemüse und Kartoffeln";4;"G4631";"G 46.31";"Großhandel mit Obst, Gemüse und Kartoffeln";""
5;"G46320";"G 46.32-0";"Großhandel mit Fleisch, Fleischwaren, Fisch und Fischerzeugnissen";4;"G4632";"G 46.32";"Großhandel mit Fleisch, Fleischwaren, Fisch und Fischerzeugnissen";""
5;"G46330";"G 46.33-0";"Großhandel mit Milch, Milcherzeugnissen, Eiern, Speiseölen und Nahrungsfetten";4;"G4633";"G 46.33";"Großhandel mit Milch, Milcherzeugnissen, Eiern, Speiseölen und Nahrungsfetten";""
5;"G46341";"G 46.34-1";"Großhandel mit Wein und Spirituosen";4;"G4634";"G 46.34";"Großhandel mit Getränken";""
5;"G46349";"G 46.34-9";"Großhandel mit sonstigen Getränken";4;"G4634";"G 46.34";"Großhandel mit Getränken";""
5;"G46350";"G 46.35-0";"Großhandel mit Tabakwaren";4;"G4635";"G 46.35";"Großhandel mit Tabakwaren";""
5;"G46360";"G 46.36-0";"Großhandel mit Zucker, Süßwaren und Backwaren";4;"G4636";"G 46.36";"Großhandel mit Zucker, Süßwaren und Backwaren";""
5;"G46370";"G 46.37-0";"Großhandel mit Kaffee, Tee, Kakao und Gewürzen";4;"G4637";"G 46.37";"Großhandel mit Kaffee, Tee, Kakao und Gewürzen";""
5;"G46380";"G 46.38-0";"Großhandel mit sonstigen Nahrungs- und Genussmitteln";4;"G4638";"G 46.38";"Großhandel mit sonstigen Nahrungs- und Genussmitteln";""
5;"G46390";"G 46.39-0";"Großhandel mit Nahrungs- und Genussmitteln, Getränken und Tabakwaren, ohne ausgeprägten Schwerpunkt";4;"G4639";"G 46.39";"Großhandel mit Nahrungs- und Genussmitteln, Getränken und Tabakwaren, ohne ausgeprägten Schwerpunkt";""
5;"G46410";"G 46.41-0";"Großhandel mit Textilien";4;"G4641";"G 46.41";"Großhandel mit Textilien";""
5;"G46421";"G 46.42-1";"Großhandel mit Bekleidung";4;"G4642";"G 46.42";"Großhandel mit Bekleidung und Schuhen";""
5;"G46422";"G 46.42-2";"Großhandel mit Schuhen";4;"G4642";"G 46.42";"Großhandel mit Bekleidung und Schuhen";""
5;"G46431";"G 46.43-1";"Großhandel mit Foto- und optischen Erzeugnissen";4;"G4643";"G 46.43";"Großhandel mit Foto- und optischen Erzeugnissen, elektrischen Haushaltsgeräten und Geräten der Unterhaltungselektronik";""
5;"G46432";"G 46.43-2";"Großhandel mit elektrischen Haushaltsgeräten";4;"G4643";"G 46.43";"Großhandel mit Foto- und optischen Erzeugnissen, elektrischen Haushaltsgeräten und Geräten der Unterhaltungselektronik";""
5;"G46433";"G 46.43-3";"Großhandel mit Geräten der Unterhaltungselektronik";4;"G4643";"G 46.43";"Großhandel mit Foto- und optischen Erzeugnissen, elektrischen Haushaltsgeräten und Geräten der Unterhaltungselektronik";""
5;"G46440";"G 46.44-0";"Großhandel mit keramischen Erzeugnissen, Glaswaren und Reinigungsmitteln";4;"G4644";"G 46.44";"Großhandel mit keramischen Erzeugnissen, Glaswaren und Reinigungsmitteln";""
5;"G46450";"G 46.45-0";"Großhandel mit kosmetischen Erzeugnissen und Körperpflegemitteln";4;"G4645";"G 46.45";"Großhandel mit kosmetischen Erzeugnissen und Körperpflegemitteln";""
5;"G46461";"G 46.46-1";"Großhandel mit pharmazeutischen Erzeugnissen";4;"G4646";"G 46.46";"Großhandel mit pharmazeutischen Erzeugnissen und medizinischen Hilfsmitteln";""
5;"G46462";"G 46.46-2";"Großhandel mit medizinischen und orthopädischen Artikeln und Laborbedarf";4;"G4646";"G 46.46";"Großhandel mit pharmazeutischen Erzeugnissen und medizinischen Hilfsmitteln";""
5;"G46470";"G 46.47-0";"Großhandel mit Möbeln, Teppichen, Lampen und Leuchten";4;"G4647";"G 46.47";"Großhandel mit Möbeln, Teppichen, Lampen und Leuchten";""
5;"G46480";"G 46.48-0";"Großhandel mit Uhren und Schmuck";4;"G4648";"G 46.48";"Großhandel mit Uhren und Schmuck";""
5;"G46491";"G 46.49-1";"Großhandel mit Schreibwaren und Bürobedarf";4;"G4649";"G 46.49";"Großhandel mit sonstigen Gebrauchs- und Verbrauchsgütern";""
5;"G46492";"G 46.49-2";"Großhandel mit Büchern, Zeitschriften und Zeitungen";4;"G4649";"G 46.49";"Großhandel mit sonstigen Gebrauchs- und Verbrauchsgütern";""
5;"G46493";"G 46.49-3";"Großhandel mit Sportartikeln";4;"G4649";"G 46.49";"Großhandel mit sonstigen Gebrauchs- und Verbrauchsgütern";""
5;"G46494";"G 46.49-4";"Großhandel mit Spielwaren und Musikinstrumenten";4;"G4649";"G 46.49";"Großhandel mit sonstigen Gebrauchs- und Verbrauchsgütern";""
5;"G46499";"G 46.49-9";"Großhandel mit sonstigen Gebrauchs- und Verbrauchsgütern a.n.g.";4;"G4649";"G 46.49";"Großhandel mit sonstigen Gebrauchs- und Verbrauchsgütern";""
5;"G46500";"G 46.50-0";"Großhandel mit Geräten der Informations- und Kommunikationstechnik";4;"G4650";"G 46.50";"Großhandel mit Geräten der Informations- und Kommunikationstechnik";""
5;"G46610";"G 46.61-0";"Großhandel mit landwirtschaftlichen Maschinen und Geräten";4;"G4661";"G 46.61";"Großhandel mit landwirtschaftlichen Maschinen und Geräten";""
5;"G46620";"G 46.62-0";"Großhandel mit Werkzeugmaschinen";4;"G4662";"G 46.62";"Großhandel mit Werkzeugmaschinen";""
5;"G46630";"G 46.63-0";"Großhandel mit Bergwerks-, Bau- und Baustoffmaschinen";4;"G4663";"G 46.63";"Großhandel mit Bergwerks-, Bau- und Baustoffmaschinen";""
5;"G46641";"G 46.64-1";"Großhandel mit Elektroinstallationsmaterial und Photovoltaikanlagen";4;"G4664";"G 46.64";"Großhandel mit sonstigen Maschinen und Ausrüstungen";""
5;"G46649";"G 46.64-9";"Großhandel mit sonstigen Maschinen und Ausrüstungen a.n.g.";4;"G4664";"G 46.64";"Großhandel mit sonstigen Maschinen und Ausrüstungen";""
5;"G46711";"G 46.71-1";"Großhandel mit Kraftwagen mit einem Gesamtgewicht von 3,5 t oder weniger";4;"G4671";"G 46.71";"Großhandel mit Kraftwagen";""
5;"G46712";"G 46.71-2";"Großhandel mit Kraftwagen mit einem Gesamtgewicht von mehr als 3,5 t";4;"G4671";"G 46.71";"Großhandel mit Kraftwagen";""
5;"G46720";"G 46.72-0";"Großhandel mit Kraftwagenteilen und -zubehör";4;"G4672";"G 46.72";"Großhandel mit Kraftwagenteilen und -zubehör";""
5;"G46730";"G 46.73-0";"Großhandel mit Krafträdern, Kraftradteilen und -zubehör";4;"G4673";"G 46.73";"Großhandel mit Krafträdern, Kraftradteilen und -zubehör";""
5;"G46811";"G 46.81-1";"Großhandel mit festen Brennstoffen";4;"G4681";"G 46.81";"Großhandel mit Brennstoffen und Mineralölerzeugnissen";""
5;"G46812";"G 46.81-2";"Großhandel mit Mineralölerzeugnissen";4;"G4681";"G 46.81";"Großhandel mit Brennstoffen und Mineralölerzeugnissen";""
5;"G46821";"G 46.82-1";"Großhandel mit Erzen, Eisen, Stahl und Halbzeug";4;"G4682";"G 46.82";"Großhandel mit Erzen, Metallen und Metallhalbzeug";""
5;"G46822";"G 46.82-2";"Großhandel mit NE-Metallen und Halbzeug";4;"G4682";"G 46.82";"Großhandel mit Erzen, Metallen und Metallhalbzeug";""
5;"G46831";"G 46.83-1";"Großhandel mit Holz";4;"G4683";"G 46.83";"Großhandel mit Holz, Baustoffen, Anstrichmitteln und Sanitärausstattung";""
5;"G46832";"G 46.83-2";"Großhandel mit Baustoffen und Sanitärkeramik";4;"G4683";"G 46.83";"Großhandel mit Holz, Baustoffen, Anstrichmitteln und Sanitärausstattung";""
5;"G46833";"G 46.83-3";"Großhandel mit Flachglas, Anstrichmitteln, Tapeten und Bodenbelägen";4;"G4683";"G 46.83";"Großhandel mit Holz, Baustoffen, Anstrichmitteln und Sanitärausstattung";""
5;"G46840";"G 46.84-0";"Großhandel mit Metall- und Kunststoffwaren für Bauzwecke sowie Installationsbedarf für Gas, Wasser und Heizung";4;"G4684";"G 46.84";"Großhandel mit Metall- und Kunststoffwaren für Bauzwecke sowie Installationsbedarf für Gas, Wasser und Heizung";""
5;"G46850";"G 46.85-0";"Großhandel mit chemischen Erzeugnissen";4;"G4685";"G 46.85";"Großhandel mit chemischen Erzeugnissen";""
5;"G46861";"G 46.86-1";"Großhandel mit Papier und Pappe";4;"G4686";"G 46.86";"Großhandel mit sonstigen Halbwaren";""
5;"G46869";"G 46.86-9";"Großhandel mit sonstigen Halbwaren a.n.g.";4;"G4686";"G 46.86";"Großhandel mit sonstigen Halbwaren";""
5;"G46870";"G 46.87-0";"Großhandel mit Altmaterialien und Reststoffen";4;"G4687";"G 46.87";"Großhandel mit Altmaterialien und Reststoffen";""
5;"G46890";"G 46.89-0";"Sonstiger Großhandel a.n.g.";4;"G4689";"G 46.89";"Sonstiger Großhandel a. n. g.";""
5;"G46900";"G 46.90-0";"Großhandel ohne ausgeprägten Schwerpunkt";4;"G4690";"G 46.90";"Großhandel ohne ausgeprägten Schwerpunkt";""
5;"G47110";"G 47.11-0";"Einzelhandel mit Waren verschiedener Art, Hauptrichtung Nahrungs- und Genussmittel";4;"G4711";"G 47.11";"Einzelhandel mit Waren verschiedener Art, Hauptrichtung Nahrungs- und Genussmittel";""
5;"G47120";"G 47.12-0";"Sonstiger Einzelhandel mit Waren verschiedener Art";4;"G4712";"G 47.12";"Sonstiger Einzelhandel mit Waren verschiedener Art";""
5;"G47210";"G 47.21-0";"Einzelhandel mit Obst, Gemüse und Kartoffeln";4;"G4721";"G 47.21";"Einzelhandel mit Obst, Gemüse und Kartoffeln";""
5;"G47220";"G 47.22-0";"Einzelhandel mit Fleisch und Fleischwaren";4;"G4722";"G 47.22";"Einzelhandel mit Fleisch und Fleischwaren";""
5;"G47230";"G 47.23-0";"Einzelhandel mit Fisch, Meeresfrüchten und Fischerzeugnissen";4;"G4723";"G 47.23";"Einzelhandel mit Fisch, Meeresfrüchten und Fischerzeugnissen";""
5;"G47240";"G 47.24-0";"Einzelhandel mit Back- und Süßwaren";4;"G4724";"G 47.24";"Einzelhandel mit Back- und Süßwaren";""
5;"G47250";"G 47.25-0";"Einzelhandel mit Getränken";4;"G4725";"G 47.25";"Einzelhandel mit Getränken";""
5;"G47260";"G 47.26-0";"Einzelhandel mit Tabakwaren";4;"G4726";"G 47.26";"Einzelhandel mit Tabakwaren";""
5;"G47270";"G 47.27-0";"Einzelhandel mit sonstigen Nahrungs- und Genussmitteln";4;"G4727";"G 47.27";"Einzelhandel mit sonstigen Nahrungs- und Genussmitteln";""
5;"G47300";"G 47.30-0";"Einzelhandel mit Motorenkraftstoffen";4;"G4730";"G 47.30";"Einzelhandel mit Motorenkraftstoffen";""
5;"G47400";"G 47.40-0";"Einzelhandel mit Geräten der Informations- und Kommunikationstechnik";4;"G4740";"G 47.40";"Einzelhandel mit Geräten der Informations- und Kommunikationstechnik";""
5;"G47510";"G 47.51-0";"Einzelhandel mit Textilien";4;"G4751";"G 47.51";"Einzelhandel mit Textilien";""
5;"G47520";"G 47.52-0";"Einzelhandel mit Metallwaren, Anstrichmitteln, Bau- und Heimwerkerbedarf";4;"G4752";"G 47.52";"Einzelhandel mit Metallwaren, Anstrichmitteln, Bau- und Heimwerkerbedarf";""
5;"G47530";"G 47.53-0";"Einzelhandel mit Vorhängen, Teppichen, Fußbodenbelägen und Tapeten";4;"G4753";"G 47.53";"Einzelhandel mit Vorhängen, Teppichen, Fußbodenbelägen und Tapeten";""
5;"G47540";"G 47.54-0";"Einzelhandel mit elektrischen Haushaltsgeräten";4;"G4754";"G 47.54";"Einzelhandel mit elektrischen Haushaltsgeräten";""
5;"G47551";"G 47.55-1";"Einzelhandel mit Möbeln";4;"G4755";"G 47.55";"Einzelhandel mit Möbeln, Einrichtungsgegenständen und sonstigem Hausrat";""
5;"G47559";"G 47.55-9";"Einzelhandel mit Einrichtungsgegenständen und Hausrat a.n.g.";4;"G4755";"G 47.55";"Einzelhandel mit Möbeln, Einrichtungsgegenständen und sonstigem Hausrat";""
5;"G47610";"G 47.61-0";"Einzelhandel mit Büchern";4;"G4761";"G 47.61";"Einzelhandel mit Büchern";""
5;"G47620";"G 47.62-0";"Einzelhandel mit Zeitschriften, Zeitungen, Schreibwaren und Bürobedarf";4;"G4762";"G 47.62";"Einzelhandel mit Zeitschriften, Zeitungen, Schreibwaren und Bürobedarf";""
5;"G47630";"G 47.63-0";"Einzelhandel mit Fahrrädern, Sport- und Campingartikeln";4;"G4763";"G 47.63";"Einzelhandel mit Fahrrädern, Sport- und Campingartikeln";""
5;"G47640";"G 47.64-0";"Einzelhandel mit Spielwaren";4;"G4764";"G 47.64";"Einzelhandel mit Spielwaren";""
5;"G47690";"G 47.69-0";"Einzelhandel mit Kunst- und Kulturerzeugnissen a.n.g.";4;"G4769";"G 47.69";"Einzelhandel mit Kunst- und Kulturerzeugnissen a. n. g.";""
5;"G47710";"G 47.71-0";"Einzelhandel mit Bekleidung";4;"G4771";"G 47.71";"Einzelhandel mit Bekleidung";""
5;"G47720";"G 47.72-0";"Einzelhandel mit Schuhen und Lederwaren";4;"G4772";"G 47.72";"Einzelhandel mit Schuhen und Lederwaren";""
5;"G47730";"G 47.73-0";"Apotheken";4;"G4773";"G 47.73";"Einzelhandel mit pharmazeutischen Erzeugnissen";""
5;"G47741";"G 47.74-1";"Einzelhandel mit optischen Artikeln ";4;"G4774";"G 47.74";"Einzelhandel mit medizinischen und orthopädischen Artikeln";""
5;"G47749";"G 47.74-9";"Einzelhandel mit sonstigen medizinischen und orthopädischen Artikeln";4;"G4774";"G 47.74";"Einzelhandel mit medizinischen und orthopädischen Artikeln";""
5;"G47750";"G 47.75-0";"Einzelhandel mit kosmetischen Erzeugnissen und Körperpflegemitteln";4;"G4775";"G 47.75";"Einzelhandel mit kosmetischen Erzeugnissen und Körperpflegemitteln";""
5;"G47761";"G 47.76-1";"Einzelhandel mit Blumen, Pflanzen, Düngemitteln; Blumenbinderei";4;"G4776";"G 47.76";"Einzelhandel mit Blumen, Pflanzen, Düngemitteln, Tierfutter und Haustieren";""
5;"G47762";"G 47.76-2";"Einzelhandel mit zoologischem Bedarf und Haustieren";4;"G4776";"G 47.76";"Einzelhandel mit Blumen, Pflanzen, Düngemitteln, Tierfutter und Haustieren";""
5;"G47770";"G 47.77-0";"Einzelhandel mit Uhren und Schmuck";4;"G4777";"G 47.77";"Einzelhandel mit Uhren und Schmuck";""
5;"G47781";"G 47.78-1";"Einzelhandel mit Fotoartikeln und Brennstoffen";4;"G4778";"G 47.78";"Einzelhandel mit sonstigen Neuwaren";""
5;"G47789";"G 47.78-9";"Einzelhandel mit sonstigen Neuwaren a.n.g.";4;"G4778";"G 47.78";"Einzelhandel mit sonstigen Neuwaren";""
5;"G47790";"G 47.79-0";"Einzelhandel mit Antiquitäten und Gebrauchtwaren";4;"G4779";"G 47.79";"Einzelhandel mit Antiquitäten und Gebrauchtwaren";""
5;"G47810";"G 47.81-0";"Einzelhandel mit Kraftwagen";4;"G4781";"G 47.81";"Einzelhandel mit Kraftwagen";""
5;"G47820";"G 47.82-0";"Einzelhandel mit Kraftwagenteilen und -zubehör";4;"G4782";"G 47.82";"Einzelhandel mit Kraftwagenteilen und -zubehör";""
5;"G47830";"G 47.83-0";"Einzelhandel mit Krafträdern, Kraftradteilen und -zubehör";4;"G4783";"G 47.83";"Einzelhandel mit Krafträdern, Kraftradteilen und -zubehör";""
5;"G47910";"G 47.91-0";"Vermittlungstätigkeiten für den Einzelhandel ohne ausgeprägten Schwerpunkt";4;"G4791";"G 47.91";"Vermittlungstätigkeiten für den Einzelhandel ohne ausgeprägten Schwerpunkt";""
5;"G47920";"G 47.92-0";"Vermittlungstätigkeiten für den Einzelhandel mit ausgeprägtem Schwerpunkt";4;"G4792";"G 47.92";"Vermittlungstätigkeiten für den Einzelhandel mit ausgeprägtem Schwerpunkt";""
5;"H49110";"H 49.11-0";"Personenbeförderung im Eisenbahnverkehr";4;"H4911";"H 49.11";"Personenbeförderung im Eisenbahnverkehr";""
5;"H49120";"H 49.12-0";"Sonstige Personenbeförderung im Schienenverkehr";4;"H4912";"H 49.12";"Sonstige Personenbeförderung im Schienenverkehr";""
5;"H49200";"H 49.20-0";"Güterbeförderung im Schienenverkehr";4;"H4920";"H 49.20";"Güterbeförderung im Schienenverkehr";""
5;"H49310";"H 49.31-0";"Personenbeförderung im Linienverkehr auf der Straße";4;"H4931";"H 49.31";"Personenbeförderung im Linienverkehr auf der Straße";""
5;"H49320";"H 49.32-0";"Personenbeförderung im Gelegenheitsverkehr auf der Straße";4;"H4932";"H 49.32";"Personenbeförderung im Gelegenheitsverkehr auf der Straße";""
5;"H49330";"H 49.33-0";"Personenbeförderung mit Fahrzeug mit Fahrer auf Abruf";4;"H4933";"H 49.33";"Personenbeförderung mit Fahrzeug mit Fahrer auf Abruf";""
5;"H49340";"H 49.34-0";"Personenbeförderung mit Seilbahnen und Skiliften";4;"H4934";"H 49.34";"Personenbeförderung mit Seilbahnen und Skiliften";""
5;"H49390";"H 49.39-0";"Sonstige Personenbeförderung im Landverkehr a.n.g.";4;"H4939";"H 49.39";"Sonstige Personenbeförderung im Landverkehr a. n. g.";""
5;"H49410";"H 49.41-0";"Güterbeförderung im Straßenverkehr";4;"H4941";"H 49.41";"Güterbeförderung im Straßenverkehr";""
5;"H49420";"H 49.42-0";"Umzugstransporte";4;"H4942";"H 49.42";"Umzugstransporte";""
5;"H49500";"H 49.50-0";"Transport in Rohrfernleitungen";4;"H4950";"H 49.50";"Transport in Rohrfernleitungen";""
5;"H50100";"H 50.10-0";"Personenbeförderung in der Hochsee- und Küstenschifffahrt";4;"H5010";"H 50.10";"Personenbeförderung in der Hochsee- und Küstenschifffahrt";""
5;"H50200";"H 50.20-0";"Güterbeförderung in der Hochsee- und Küstenschifffahrt";4;"H5020";"H 50.20";"Güterbeförderung in der Hochsee- und Küstenschifffahrt";""
5;"H50300";"H 50.30-0";"Personenbeförderung in der Binnenschifffahrt";4;"H5030";"H 50.30";"Personenbeförderung in der Binnenschifffahrt";""
5;"H50400";"H 50.40-0";"Güterbeförderung in der Binnenschifffahrt";4;"H5040";"H 50.40";"Güterbeförderung in der Binnenschifffahrt";""
5;"H51100";"H 51.10-0";"Personenbeförderung in der Luftfahrt";4;"H5110";"H 51.10";"Personenbeförderung in der Luftfahrt";""
5;"H51210";"H 51.21-0";"Güterbeförderung in der Luftfahrt";4;"H5121";"H 51.21";"Güterbeförderung in der Luftfahrt";""
5;"H51220";"H 51.22-0";"Raumtransport";4;"H5122";"H 51.22";"Raumtransport";""
5;"H52101";"H 52.10-1";"Erdöl- und Erdgaslagerei";4;"H5210";"H 52.10";"Lagerei";""
5;"H52109";"H 52.10-9";"Sonstige Lagerei";4;"H5210";"H 52.10";"Lagerei";""
5;"H52211";"H 52.21-1";"Parkhäuser und Parkgaragen";4;"H5221";"H 52.21";"Erbringung von sonstigen Dienstleistungen für den Landverkehr";""
5;"H52212";"H 52.21-2";"Mautstraßen";4;"H5221";"H 52.21";"Erbringung von sonstigen Dienstleistungen für den Landverkehr";""
5;"H52213";"H 52.21-3";"Betrieb von Eisenbahninfrastruktur";4;"H5221";"H 52.21";"Erbringung von sonstigen Dienstleistungen für den Landverkehr";""
5;"H52219";"H 52.21-9";"Erbringung von sonstigen Dienstleistungen für den Landverkehr a.n.g.";4;"H5221";"H 52.21";"Erbringung von sonstigen Dienstleistungen für den Landverkehr";""
5;"H52220";"H 52.22-0";"Erbringung von sonstigen Dienstleistungen für die Schifffahrt";4;"H5222";"H 52.22";"Erbringung von sonstigen Dienstleistungen für die Schifffahrt";""
5;"H52230";"H 52.23-0";"Erbringung von sonstigen Dienstleistungen für die Luftfahrt";4;"H5223";"H 52.23";"Erbringung von sonstigen Dienstleistungen für die Luftfahrt";""
5;"H52240";"H 52.24-0";"Frachtumschlag";4;"H5224";"H 52.24";"Frachtumschlag";""
5;"H52250";"H 52.25-0";"Erbringung von Logistikdienstleistungen";4;"H5225";"H 52.25";"Erbringung von Logistikdienstleistungen";""
5;"H52260";"H 52.26-0";"Erbringung von sonstigen Dienstleistungen für den Verkehr";4;"H5226";"H 52.26";"Erbringung von sonstigen Dienstleistungen für den Verkehr";""
5;"H52310";"H 52.31-0";"Vermittlungstätigkeiten für die Güterbeförderung";4;"H5231";"H 52.31";"Vermittlungstätigkeiten für die Güterbeförderung";""
5;"H52320";"H 52.32-0";"Vermittlungstätigkeiten für die Personenbeförderung";4;"H5232";"H 52.32";"Vermittlungstätigkeiten für die Personenbeförderung";""
5;"H53100";"H 53.10-0";"Postdienste von Universaldienstleistungsanbietern";4;"H5310";"H 53.10";"Postdienste von Universaldienstleistungsanbietern";""
5;"H53200";"H 53.20-0";"Sonstige Post-, Kurier- und Expressdienste";4;"H5320";"H 53.20";"Sonstige Post-, Kurier- und Expressdienste";""
5;"H53300";"H 53.30-0";"Vermittlungstätigkeiten für Post-, Kurier- und Expressdienstleistungen";4;"H5330";"H 53.30";"Vermittlungstätigkeiten für Post-, Kurier- und Expressdienstleistungen";""
5;"I55101";"I 55.10-1";"Hotels";4;"I5510";"I 55.10";"Hotels, Gasthöfe und Pensionen";""
5;"I55102";"I 55.10-2";"Gasthöfe und Pensionen";4;"I5510";"I 55.10";"Hotels, Gasthöfe und Pensionen";""
5;"I55201";"I 55.20-1";"Jugendherbergen und Schutzhütten";4;"I5520";"I 55.20";"Ferienunterkünfte und ähnliche Beherbergungsstätten";""
5;"I55202";"I 55.20-2";"Ferienhäuser und Ferienwohnungen";4;"I5520";"I 55.20";"Ferienunterkünfte und ähnliche Beherbergungsstätten";""
5;"I55300";"I 55.30-0";"Campingplätze";4;"I5530";"I 55.30";"Campingplätze";""
5;"I55400";"I 55.40-0";"Vermittlungstätigkeiten für Beherbergungsdienstleistungen";4;"I5540";"I 55.40";"Vermittlungstätigkeiten für Beherbergungsdienstleistungen";""
5;"I55900";"I 55.90-0";"Sonstige Beherbergungsstätten";4;"I5590";"I 55.90";"Sonstige Beherbergungsstätten";""
5;"I56111";"I 56.11-1";"Restaurants und Gaststätten";4;"I5611";"I 56.11";"Restaurants, Gaststätten, Imbissstuben, Cafés, Eissalons u. Ä.";""
5;"I56112";"I 56.11-2";"Buffets und Imbissstuben";4;"I5611";"I 56.11";"Restaurants, Gaststätten, Imbissstuben, Cafés, Eissalons u. Ä.";""
5;"I56113";"I 56.11-3";"Cafehäuser";4;"I5611";"I 56.11";"Restaurants, Gaststätten, Imbissstuben, Cafés, Eissalons u. Ä.";""
5;"I56114";"I 56.11-4";"Eissalons";4;"I5611";"I 56.11";"Restaurants, Gaststätten, Imbissstuben, Cafés, Eissalons u. Ä.";""
5;"I56120";"I 56.12-0";"Mobile Gastronomie";4;"I5612";"I 56.12";"Mobile Gastronomie";""
5;"I56210";"I 56.21-0";"Event-Caterer";4;"I5621";"I 56.21";"Event-Caterer";""
5;"I56220";"I 56.22-0";"Sonstige Caterer und Erbringung sonstiger Verpflegungsdienstleistungen";4;"I5622";"I 56.22";"Sonstige Caterer und Erbringung sonstiger Verpflegungsdienstleistungen";""
5;"I56300";"I 56.30-0";"Ausschank von Getränken";4;"I5630";"I 56.30";"Ausschank von Getränken";""
5;"I56400";"I 56.40-0";"Vermittlungstätigkeiten für gastronomische Dienstleistungen";4;"I5640";"I 56.40";"Vermittlungstätigkeiten für gastronomische Dienstleistungen";""
5;"J58110";"J 58.11-0";"Verlegen von Büchern";4;"J5811";"J 58.11";"Verlegen von Büchern";""
5;"J58120";"J 58.12-0";"Verlegen von Zeitungen";4;"J5812";"J 58.12";"Verlegen von Zeitungen";""
5;"J58130";"J 58.13-0";"Verlegen von Zeitschriften";4;"J5813";"J 58.13";"Verlegen von Zeitschriften";""
5;"J58190";"J 58.19-0";"Sonstiges Verlagswesen, ohne Software";4;"J5819";"J 58.19";"Sonstiges Verlagswesen, ohne Software";""
5;"J58210";"J 58.21-0";"Verlegen von Computerspielen";4;"J5821";"J 58.21";"Verlegen von Computerspielen";""
5;"J58290";"J 58.29-0";"Verlegen von sonstiger Software";4;"J5829";"J 58.29";"Verlegen von sonstiger Software";""
5;"J59110";"J 59.11-0";"Herstellung von Filmen, Videofilmen und Fernsehprogrammen";4;"J5911";"J 59.11";"Herstellung von Filmen, Videofilmen und Fernsehprogrammen";""
5;"J59120";"J 59.12-0";"Nachbearbeitung und sonstige Filmtechnik";4;"J5912";"J 59.12";"Nachbearbeitung und sonstige Filmtechnik";""
5;"J59130";"J 59.13-0";"Filmverleih und -vertrieb, nicht an private Haushalte";4;"J5913";"J 59.13";"Filmverleih und -vertrieb, nicht an private Haushalte";""
5;"J59140";"J 59.14-0";"Kinos";4;"J5914";"J 59.14";"Kinos";""
5;"J59200";"J 59.20-0";"Tonstudios; Herstellung von Hörfunkbeiträgen; Verlegen von bespielten Tonträgern und Musikalien";4;"J5920";"J 59.20";"Tonstudios; Herstellung von Hörfunkbeiträgen; Verlegen von bespielten Tonträgern und Musikalien";""
5;"J60100";"J 60.10-0";"Hörfunkveranstalter und Verbreitung von Audioinhalten";4;"J6010";"J 60.10";"Hörfunkveranstalter und Verbreitung von Audioinhalten";""
5;"J60200";"J 60.20-0";"Fernsehveranstalter und Verbreitung von Videoinhalten";4;"J6020";"J 60.20";"Fernsehveranstalter und Verbreitung von Videoinhalten";""
5;"J60310";"J 60.31-0";"Nachrichtenagenturen";4;"J6031";"J 60.31";"Nachrichtenagenturen";""
5;"J60390";"J 60.39-0";"Sonstige Verbreitung von Medieninhalten";4;"J6039";"J 60.39";"Sonstige Verbreitung von Medieninhalten";""
5;"K61100";"K 61.10-0";"Leitungsgebundene, drahtlose und satellitengestützte Telekommunikation";4;"K6110";"K 61.10";"Leitungsgebundene, drahtlose und satellitengestützte Telekommunikation";""
5;"K61200";"K 61.20-0";"Wiederverkaufs- und Vermittlungstätigkeiten für die Telekommunikation";4;"K6120";"K 61.20";"Wiederverkaufs- und Vermittlungstätigkeiten für die Telekommunikation";""
5;"K61900";"K 61.90-0";"Sonstige Telekommunikation";4;"K6190";"K 61.90";"Sonstige Telekommunikation";""
5;"K62100";"K 62.10-0";"Programmierungstätigkeiten";4;"K6210";"K 62.10";"Programmierungstätigkeiten";""
5;"K62200";"K 62.20-0";"Erbringung von Dienstleistungen der IT-Beratung sowie des Betriebs von Datenverarbeitungseinrichtungen";4;"K6220";"K 62.20";"Erbringung von Dienstleistungen der IT-Beratung sowie des Betriebs von Datenverarbeitungseinrichtungen";""
5;"K62900";"K 62.90-0";"Erbringung von sonstigen Dienstleistungen der Informationstechnologie";4;"K6290";"K 62.90";"Erbringung von sonstigen Dienstleistungen der Informationstechnologie";""
5;"K63100";"K 63.10-0";"Datenverarbeitung, Hosting und damit verbundene Tätigkeiten";4;"K6310";"K 63.10";"Datenverarbeitung, Hosting und damit verbundene Tätigkeiten";""
5;"K63910";"K 63.91-0";"Web-Suchportale";4;"K6391";"K 63.91";"Web-Suchportale";""
5;"K63920";"K 63.92-0";"Erbringung von sonstigen Informationsdienstleistungen";4;"K6392";"K 63.92";"Erbringung von sonstigen Informationsdienstleistungen";""
5;"L64110";"L 64.11-0";"Zentralbanken";4;"L6411";"L 64.11";"Zentralbanken";""
5;"L64190";"L 64.19-0";"Kreditinstitute, ohne Spezialkreditinstitute";4;"L6419";"L 64.19";"Kreditinstitute, ohne Spezialkreditinstitute";""
5;"L64210";"L 64.21-0";"Beteiligungsgesellschaften";4;"L6421";"L 64.21";"Beteiligungsgesellschaften";""
5;"L64220";"L 64.22-0";"Finanzierungs-Conduits";4;"L6422";"L 64.22";"Finanzierungs-Conduits";""
