"Ebene";"EDV-Code";"Code";"Titel";"korrespondierende Ebene";"korrespondierender EDV-Code";"korrespondierender Code";"korrespondierender Titel";"Korrespondenz-Beschreibung"
5;"A01110";"A 01.11-0";"Anbau von anderem Getreide als Reis sowie von Hülsenfrüchten und Ölsaaten";4;"A0111";"A 01.11";"Anbau von anderem Getreide als Reis sowie von Hülsenfrüchten und Ölsaaten";""
5;"A01120";"A 01.12-0";"Anbau von Reis";4;"A0112";"A 01.12";"Anbau von Reis";""
5;"A01130";"A 01.13-0";"Anbau von Gemüse und Melonen sowie Wurzeln und Knollen";4;"A0113";"A 01.13";"Anbau von Gemüse und Melonen sowie Wurzeln und Knollen";""
5;"A01140";"A 01.14-0";"Anbau von Zuckerrohr";4;"A0114";"A 01.14";"Anbau von Zuckerrohr";""
5;"A01150";"A 01.15-0";"Anbau von Tabak";4;"A0115";"A 01.15";"Anbau von Tabak";""
5;"A01160";"A 01.16-0";"Anbau von Faserpflanzen";4;"A0116";"A 01.16";"Anbau von Faserpflanzen";""
5;"A01190";"A 01.19-0";"Anbau von sonstigen ein- und zweijährigen Pflanzen";4;"A0119";"A 01.19";"Anbau von sonstigen ein- und zweijährigen Pflanzen";""
5;"A01210";"A 01.21-0";"Anbau von Wein- und Tafeltrauben";4;"A0121";"A 01.21";"Anbau von Wein- und Tafeltrauben";""
5;"A01220";"A 01.22-0";"Anbau von tropischen und subtropischen Früchten";4;"A0122";"A 01.22";"Anbau von tropischen und subtropischen Früchten";""
5;"A01230";"A 01.23-0";"Anbau von Zitrusfrüchten";4;"A0123";"A 01.23";"Anbau von Zitrusfrüchten";""
5;"A01240";"A 01.24-0";"Anbau von Kern- und Steinobst";4;"A0124";"A 01.24";"Anbau von Kern- und Steinobst";""
5;"A01250";"A 01.25-0";"Anbau von sonstigem Obst und Nüssen";4;"A0125";"A 01.25";"Anbau von sonstigem Obst und Nüssen";""
5;"A01260";"A 01.26-0";"Anbau von ölhaltigen Früchten";4;"A0126";"A 01.26";"Anbau von ölhaltigen Früchten";""
5;"A01270";"A 01.27-0";"Anbau von Pflanzen zur Herstellung von Getränken";4;"A0127";"A 01.27";"Anbau von Pflanzen zur Herstellung von Getränken";""
5;"A01280";"A 01.28-0";"Anbau von Gewürzpflanzen, Pflanzen für aromatische, narkotische und pharmazeutische Zwecke";4;"A0128";"A 01.28";"Anbau von Gewürzpflanzen, Pflanzen für aromatische, narkotische und pharmazeutische Zwecke";""
5;"A01290";"A 01.29-0";"Anbau sonstiger mehrjähriger Pflanzen";4;"A0129";"A 01.29";"Anbau sonstiger mehrjähriger Pflanzen";""
5;"A01300";"A 01.30-0";"Betrieb von Baumschulen, sowie Anbau von Pflanzen zu Vermehrungszwecken";4;"A0130";"A 01.30";"Betrieb von Baumschulen sowie Anbau von Pflanzen zu Vermehrungszwecken";""
5;"A01410";"A 01.41-0";"Haltung von Milchkühen";4;"A0141";"A 01.41";"Haltung von Milchkühen";""
5;"A01420";"A 01.42-0";"Haltung von sonstigen Rindern";4;"A0142";"A 01.42";"Haltung von sonstigen Rindern";""
5;"A01430";"A 01.43-0";"Haltung von Pferden und Eseln";4;"A0143";"A 01.43";"Haltung von Pferden und Eseln";""
5;"A01440";"A 01.44-0";"Haltung von Kamelen";4;"A0144";"A 01.44";"Haltung von Kamelen";""
5;"A01450";"A 01.45-0";"Haltung von Schafen und Ziegen";4;"A0145";"A 01.45";"Haltung von Schafen und Ziegen";""
5;"A01460";"A 01.46-0";"Haltung von Schweinen";4;"A0146";"A 01.46";"Haltung von Schweinen";""
5;"A01470";"A 01.47-0";"Haltung von Geflügel";4;"A0147";"A 01.47";"Haltung von Geflügel";""
5;"A01480";"A 01.48-0";"Sonstige Tierhaltung";4;"A0148";"A 01.48";"Sonstige Tierhaltung";""
5;"A01500";"A 01.50-0";"Gemischte Landwirtschaft";4;"A0150";"A 01.50";"Gemischte Landwirtschaft";""
5;"A01610";"A 01.61-0";"Erbringung von landwirtschaftlichen Dienstleistungen für den Pflanzenbau";4;"A0161";"A 01.61";"Erbringung von landwirtschaftlichen Dienstleistungen für den Pflanzenbau";""
5;"A01620";"A 01.62-0";"Erbringung von landwirtschaftlichen Dienstleistungen für die Tierhaltung";4;"A0162";"A 01.62";"Erbringung von landwirtschaftlichen Dienstleistungen für die Tierhaltung";""
5;"A01630";"A 01.63-0";"Nach der Ernte anfallende Tätigkeiten in der pflanzlichen Erzeugung und Saatgutaufbereitung";4;"A0163";"A 01.63";"Nach der Ernte anfallende Tätigkeiten in der pflanzlichen Erzeugung und Saatgutaufbereitung";""
5;"A01700";"A 01.70-0";"Jagd, Fallenstellerei und damit verbundene Tätigkeiten";4;"A0170";"A 01.70";"Jagd, Fallenstellerei und damit verbundene Tätigkeiten";""
5;"A02100";"A 02.10-0";"Forstwirtschaft";4;"A0210";"A 02.10";"Forstwirtschaft";""
5;"A02200";"A 02.20-0";"Holzeinschlag";4;"A0220";"A 02.20";"Holzeinschlag";""
5;"A02300";"A 02.30-0";"Sammeln von wildwachsenden Produkten, ohne Holz";4;"A0230";"A 02.30";"Sammeln von wildwachsenden Produkten, ohne Holz";""
5;"A02400";"A 02.40-0";"Erbringung von Dienstleistungen für Forstwirtschaft und Holzeinschlag";4;"A0240";"A 02.40";"Erbringung von Dienstleistungen für Forstwirtschaft und Holzeinschlag";""
5;"A03110";"A 03.11-0";"Meeresfischerei";4;"A0311";"A 03.11";"Meeresfischerei";""
5;"A03120";"A 03.12-0";"Süßwasserfischerei";4;"A0312";"A 03.12";"Süßwasserfischerei";""
5;"A03210";"A 03.21-0";"Meeresaquakultur";4;"A0321";"A 03.21";"Meeresaquakultur";""
5;"A03220";"A 03.22-0";"Süßwasseraquakultur";4;"A0322";"A 03.22";"Süßwasseraquakultur";""
5;"A03300";"A 03.30-0";"Erbringung von Dienstleistungen für Fischerei und Aquakultur";4;"A0330";"A 03.30";"Erbringung von Dienstleistungen für Fischerei und Aquakultur";""
5;"B05100";"B 05.10-0";"Steinkohlenbergbau";4;"B0510";"B 05.10";"Steinkohlenbergbau";""
5;"B05200";"B 05.20-0";"Braunkohlenbergbau";4;"B0520";"B 05.20";"Braunkohlenbergbau";""
5;"B06100";"B 06.10-0";"Gewinnung von Erdöl";4;"B0610";"B 06.10";"Gewinnung von Erdöl";""
5;"B06200";"B 06.20-0";"Gewinnung von Erdgas";4;"B0620";"B 06.20";"Gewinnung von Erdgas";""
5;"B07100";"B 07.10-0";"Eisenerzbergbau";4;"B0710";"B 07.10";"Eisenerzbergbau";""
5;"B07210";"B 07.21-0";"Bergbau auf Uran- und Thoriumerze";4;"B0721";"B 07.21";"Bergbau auf Uran- und Thoriumerze";""
5;"B07290";"B 07.29-0";"Sonstiger NE-Metallerzbergbau";4;"B0729";"B 07.29";"Sonstiger NE-Metallerzbergbau";""
5;"B08110";"B 08.11-0";"Gewinnung von Naturwerksteinen, Kalk- und Gipsstein, Schiefer und sonstigem Gestein";4;"B0811";"B 08.11";"Gewinnung von Naturwerksteinen, Kalk- und Gipsstein, Schiefer und sonstigem Gestein";""
5;"B08120";"B 08.12-0";"Gewinnung von Kies und Sand, Ton und Kaolin";4;"B0812";"B 08.12";"Gewinnung von Kies und Sand, Ton und Kaolin";""
5;"B08910";"B 08.91-0";"Bergbau auf chemische und Düngemittelminerale";4;"B0891";"B 08.91";"Bergbau auf chemische und Düngemittelminerale";""
5;"B08920";"B 08.92-0";"Torfgewinnung";4;"B0892";"B 08.92";"Torfgewinnung";""
5;"B08930";"B 08.93-0";"Gewinnung von Salz";4;"B0893";"B 08.93";"Gewinnung von Salz";""
5;"B08990";"B 08.99-0";"Gewinnung von Steinen und Erden a.n.g.";4;"B0899";"B 08.99";"Gewinnung von Steinen und Erden a. n. g.";""
5;"B09100";"B 09.10-0";"Erbringung von Dienstleistungen für die Gewinnung von Erdöl und Erdgas";4;"B0910";"B 09.10";"Erbringung von Dienstleistungen für die Gewinnung von Erdöl und Erdgas";""
5;"B09900";"B 09.90-0";"Erbringung von Dienstleistungen für den sonstigen Bergbau und die Gewinnung von Steinen und Erden";4;"B0990";"B 09.90";"Erbringung von Dienstleistungen für den sonstigen Bergbau und die Gewinnung von Steinen und Erden";""
5;"C10110";"C 10.11-0";"Schlachten, ohne Schlachten von Geflügel";4;"C1011";"C 10.11";"Schlachten, ohne Schlachten von Geflügel";""
5;"C10120";"C 10.12-0";"Schlachten von Geflügel";4;"C1012";"C 10.12";"Schlachten von Geflügel";""
5;"C10130";"C 10.13-0";"Fleischverarbeitung";4;"C1013";"C 10.13";"Fleischverarbeitung";""
5;"C10200";"C 10.20-0";"Fischverarbeitung";4;"C1020";"C 10.20";"Fischverarbeitung";""
5;"C10310";"C 10.31-0";"Kartoffelverarbeitung";4;"C1031";"C 10.31";"Kartoffelverarbeitung";""
5;"C10320";"C 10.32-0";"Herstellung von Frucht- und Gemüsesäften";4;"C1032";"C 10.32";"Herstellung von Frucht- und Gemüsesäften";""
5;"C10390";"C 10.39-0";"Sonstige Verarbeitung von Obst und Gemüse";4;"C1039";"C 10.39";"Sonstige Verarbeitung von Obst und Gemüse";""
5;"C10410";"C 10.41-0";"Herstellung von Ölen und Fetten, ohne Margarine u. ä. Nahrungsfette";4;"C1041";"C 10.41";"Herstellung von Ölen und Fetten, ohne Margarine u. Ä. Nahrungsfette";""
5;"C10420";"C 10.42-0";"Herstellung von Margarine u. ä. Nahrungsfetten";4;"C1042";"C 10.42";"Herstellung von Margarine u. Ä. Nahrungsfetten";""
5;"C10510";"C 10.51-0";"Herstellung von Milcherzeugnissen";4;"C1051";"C 10.51";"Herstellung von Milcherzeugnissen";""
5;"C10520";"C 10.52-0";"Herstellung von Speiseeis";4;"C1052";"C 10.52";"Herstellung von Speiseeis";""
5;"C10610";"C 10.61-0";"Mahl- und Schälmühlen";4;"C1061";"C 10.61";"Mahl- und Schälmühlen";""
5;"C10620";"C 10.62-0";"Herstellung von Stärke und Stärkeerzeugnissen";4;"C1062";"C 10.62";"Herstellung von Stärke und Stärkeerzeugnissen";""
5;"C10711";"C 10.71-1";"Herstellung von Schwarz- und Weißbackwaren";4;"C1071";"C 10.71";"Herstellung von Backwaren, ohne Dauerbackwaren";""
5;"C10712";"C 10.71-2";"Herstellung von Zuckerbäcker- und Konditorwaren";4;"C1071";"C 10.71";"Herstellung von Backwaren, ohne Dauerbackwaren";""
5;"C10720";"C 10.72-0";"Herstellung von Dauerbackwaren";4;"C1072";"C 10.72";"Herstellung von Dauerbackwaren";""
5;"C10730";"C 10.73-0";"Herstellung von Teigwaren";4;"C1073";"C 10.73";"Herstellung von Teigwaren";""
5;"C10810";"C 10.81-0";"Herstellung von Zucker";4;"C1081";"C 10.81";"Herstellung von Zucker";""
5;"C10820";"C 10.82-0";"Herstellung von Süßwaren, ohne Dauerbackwaren";4;"C1082";"C 10.82";"Herstellung von Süßwaren, ohne Dauerbackwaren";""
5;"C10830";"C 10.83-0";"Verarbeitung von Kaffee und Tee, Herstellung von Kaffee-Ersatz";4;"C1083";"C 10.83";"Verarbeitung von Kaffee und Tee, Herstellung von Kaffee-Ersatz";""
5;"C10840";"C 10.84-0";"Herstellung von Würzmitteln und Soßen";4;"C1084";"C 10.84";"Herstellung von Würzmitteln und Soßen";""
5;"C10850";"C 10.85-0";"Herstellung von Fertiggerichten";4;"C1085";"C 10.85";"Herstellung von Fertiggerichten";""
5;"C10860";"C 10.86-0";"Herstellung von homogenisierten und diätetischen Nahrungsmitteln";4;"C1086";"C 10.86";"Herstellung von homogenisierten und diätetischen Nahrungsmitteln";""
5;"C10890";"C 10.89-0";"Herstellung von sonstigen Nahrungsmitteln a.n.g.";4;"C1089";"C 10.89";"Herstellung von sonstigen Nahrungsmitteln a. n. g.";""
5;"C10910";"C 10.91-0";"Herstellung von Futtermitteln für Nutztiere";4;"C1091";"C 10.91";"Herstellung von Futtermitteln für Nutztiere";""
5;"C10920";"C 10.92-0";"Herstellung von Futtermitteln für sonstige Tiere";4;"C1092";"C 10.92";"Herstellung von Futtermitteln für sonstige Tiere";""
5;"C11010";"C 11.01-0";"Herstellung von Spirituosen";4;"C1101";"C 11.01";"Herstellung von Spirituosen";""
5;"C11020";"C 11.02-0";"Herstellung von Traubenwein";4;"C1102";"C 11.02";"Herstellung von Traubenwein";""
5;"C11030";"C 11.03-0";"Herstellung von Apfelwein und sonstigen gegorenen Getränken aus Obst";4;"C1103";"C 11.03";"Herstellung von Apfelwein und sonstigen gegorenen Getränken aus Obst";""
5;"C11040";"C 11.04-0";"Herstellung von Wermutwein und sonstigen aromatisierten Weinen";4;"C1104";"C 11.04";"Herstellung von Wermutwein und sonstigen aromatisierten Weinen";""
5;"C11050";"C 11.05-0";"Herstellung von Bier";4;"C1105";"C 11.05";"Herstellung von Bier";""
5;"C11060";"C 11.06-0";"Herstellung von Malz";4;"C1106";"C 11.06";"Herstellung von Malz";""
5;"C11070";"C 11.07-0";"Herstellung von Erfrischungsgetränken und Mineralwässern";4;"C1107";"C 11.07";"Herstellung von Erfrischungsgetränken und Mineralwässern";""
5;"C12000";"C 12.00-0";"Tabakverarbeitung";4;"C1200";"C 12.00";"Tabakverarbeitung";""
5;"C13100";"C 13.10-0";"Spinnstoffaufbereitung und Spinnerei";4;"C1310";"C 13.10";"Spinnstoffaufbereitung und Spinnerei";""
5;"C13200";"C 13.20-0";"Weberei";4;"C1320";"C 13.20";"Weberei";""
5;"C13300";"C 13.30-0";"Veredlung von Textilien und Bekleidung";4;"C1330";"C 13.30";"Veredlung von Textilien und Bekleidung";""
5;"C13910";"C 13.91-0";"Herstellung von gewirktem und gestricktem Stoff";4;"C1391";"C 13.91";"Herstellung von gewirktem und gestricktem Stoff";""
5;"C13920";"C 13.92-0";"Herstellung von Heimtextilien und konfektionierten Textilwaren für die Innenausstattung";4;"C1392";"C 13.92";"Herstellung von Heimtextilien und konfektionierten Textilwaren für die Innenausstattung";""
5;"C13930";"C 13.93-0";"Herstellung von Teppichen";4;"C1393";"C 13.93";"Herstellung von Teppichen";""
5;"C13940";"C 13.94-0";"Herstellung von Seilerwaren";4;"C1394";"C 13.94";"Herstellung von Seilerwaren";""
5;"C13950";"C 13.95-0";"Herstellung von Vliesstoff und nicht konfektionierten Erzeugnissen daraus";4;"C1395";"C 13.95";"Herstellung von Vliesstoff und nicht-konfektionierten Erzeugnissen daraus";""
5;"C13960";"C 13.96-0";"Herstellung von technischen Textilien";4;"C1396";"C 13.96";"Herstellung von technischen Textilien";""
5;"C13990";"C 13.99-0";"Herstellung von sonstigen Textilwaren a.n.g.";4;"C1399";"C 13.99";"Herstellung von sonstigen Textilwaren a. n. g.";""
5;"C14100";"C 14.10-0";"Herstellung von Bekleidung aus gewirktem und gestricktem Stoff";4;"C1410";"C 14.10";"Herstellung von Bekleidung aus gewirktem und gestricktem Stoff";""
5;"C14210";"C 14.21-0";"Herstellung von Oberbekleidung";4;"C1421";"C 14.21";"Herstellung von Oberbekleidung";""
5;"C14220";"C 14.22-0";"Herstellung von Wäsche";4;"C1422";"C 14.22";"Herstellung von Wäsche";""
5;"C14230";"C 14.23-0";"Herstellung von Arbeits- und Berufsbekleidung";4;"C1423";"C 14.23";"Herstellung von Arbeits- und Berufsbekleidung";""
5;"C14240";"C 14.24-0";"Herstellung von Lederbekleidung und Pelzwaren";4;"C1424";"C 14.24";"Herstellung von Lederbekleidung und Pelzwaren";""
5;"C14290";"C 14.29-0";"Herstellung von sonstiger Bekleidung und Bekleidungszubehör a.n.g.";4;"C1429";"C 14.29";"Herstellung von sonstiger Bekleidung und Bekleidungszubehör a. n. g.";""
5;"C15110";"C 15.11-0";"Gerben, Färben, Zurichten von Leder und Fellen";4;"C1511";"C 15.11";"Gerben, Färben, Zurichten von Leder und Fellen";""
5;"C15120";"C 15.12-0";"Herstellung von Reisegepäck, Handtaschen, Sattlerwaren und Geschirren aus Stoffen aller Art";4;"C1512";"C 15.12";"Herstellung von Reisegepäck, Handtaschen, Sattlerwaren und Geschirren aus Stoffen aller Art";""
5;"C15200";"C 15.20-0";"Herstellung von Schuhen";4;"C1520";"C 15.20";"Herstellung von Schuhen";""
5;"C16110";"C 16.11-0";"Säge- und Hobelwerke";4;"C1611";"C 16.11";"Säge- und Hobelwerke";""
5;"C16120";"C 16.12-0";"Bearbeitung und Veredlung von Holz";4;"C1612";"C 16.12";"Bearbeitung und Veredlung von Holz";""
5;"C16210";"C 16.21-0";"Herstellung von Furnier-, Sperrholz-, Holzfaser- und Holzspanplatten";4;"C1621";"C 16.21";"Herstellung von Furnier-, Sperrholz-, Holzfaser- und Holzspanplatten";""
5;"C16220";"C 16.22-0";"Herstellung von Parketttafeln";4;"C1622";"C 16.22";"Herstellung von Parketttafeln";""
5;"C16231";"C 16.23-1";"Fertighaus- und Hallenerzeugung";4;"C1623";"C 16.23";"Herstellung von sonstigen Konstruktionsteilen, Fertigbauteilen, Ausbauelementen und Fertigteilbauten aus Holz";""
5;"C16239";"C 16.23-9";"Herstellung von sonstigen Konstruktionsteilen und Ausbauelementen aus Holz a.n.g.";4;"C1623";"C 16.23";"Herstellung von sonstigen Konstruktionsteilen, Fertigbauteilen, Ausbauelementen und Fertigteilbauten aus Holz";""
5;"C16240";"C 16.24-0";"Herstellung von Verpackungsmitteln, Lagerbehältern und Ladungsträgern aus Holz";4;"C1624";"C 16.24";"Herstellung von Verpackungsmitteln, Lagerbehältern und Ladungsträgern aus Holz";""
5;"C16250";"C 16.25-0";"Herstellung von Türen und Fenstern aus Holz";4;"C1625";"C 16.25";"Herstellung von Türen und Fenstern aus Holz";""
5;"C16260";"C 16.26-0";"Herstellung von festen Brennstoffen aus pflanzlicher Biomasse";4;"C1626";"C 16.26";"Herstellung von festen Brennstoffen aus pflanzlicher Biomasse";""
5;"C16270";"C 16.27-0";"Veredlung von Holzwaren";4;"C1627";"C 16.27";"Veredlung von Holzwaren";""
5;"C16280";"C 16.28-0";"Herstellung von sonstigen Holzwaren sowie Kork-, Flecht- und Korbwaren";4;"C1628";"C 16.28";"Herstellung von sonstigen Holzwaren sowie Kork-, Flecht- und Korbwaren";""
5;"C17110";"C 17.11-0";"Herstellung von Holz- und Zellstoff";4;"C1711";"C 17.11";"Herstellung von Holz- und Zellstoff";""
5;"C17120";"C 17.12-0";"Herstellung von Papier, Karton und Pappe";4;"C1712";"C 17.12";"Herstellung von Papier, Karton und Pappe";""
5;"C17210";"C 17.21-0";"Herstellung von Wellpapier und -pappe sowie von Verpackungsmitteln aus Papier, Karton und Pappe";4;"C1721";"C 17.21";"Herstellung von Wellpapier und -pappe sowie von Verpackungsmitteln aus Papier, Karton und Pappe";""
5;"C17220";"C 17.22-0";"Herstellung von Haushalts-, Hygiene- und Toilettenartikeln aus Zellstoff, Papier und Pappe";4;"C1722";"C 17.22";"Herstellung von Haushalts-, Hygiene- und Toilettenartikeln aus Zellstoff, Papier und Pappe";""
5;"C17230";"C 17.23-0";"Herstellung von Schreibwaren und Bürobedarf aus Papier, Karton und Pappe";4;"C1723";"C 17.23";"Herstellung von Schreibwaren und Bürobedarf aus Papier, Karton und Pappe";""
5;"C17240";"C 17.24-0";"Herstellung von Tapeten";4;"C1724";"C 17.24";"Herstellung von Tapeten";""
5;"C17250";"C 17.25-0";"Herstellung von sonstigen Waren aus Papier, Karton und Pappe";4;"C1725";"C 17.25";"Herstellung von sonstigen Waren aus Papier, Karton und Pappe";""
5;"C18110";"C 18.11-0";"Drucken von Zeitungen";4;"C1811";"C 18.11";"Drucken von Zeitungen";""
5;"C18120";"C 18.12-0";"Sonstiges Drucken";4;"C1812";"C 18.12";"Sonstiges Drucken";""
5;"C18130";"C 18.13-0";"Druck- und Medienvorstufe";4;"C1813";"C 18.13";"Druck- und Medienvorstufe";""
5;"C18140";"C 18.14-0";"Binden von Druckerzeugnissen und damit verbundene Dienstleistungen";4;"C1814";"C 18.14";"Binden von Druckerzeugnissen und damit verbundene Dienstleistungen";""
5;"C18200";"C 18.20-0";"Vervielfältigung von bespielten Ton-, Bild- und Datenträgern";4;"C1820";"C 18.20";"Vervielfältigung von bespielten Ton-, Bild- und Datenträgern";""
5;"C19100";"C 19.10-0";"Kokerei";4;"C1910";"C 19.10";"Kokerei";""
5;"C19200";"C 19.20-0";"Herstellung von Mineralölerzeugnissen und von fossilen Brennstoffen";4;"C1920";"C 19.20";"Herstellung von Mineralölerzeugnissen und von fossilen Brennstoffen";""
5;"C20110";"C 20.11-0";"Herstellung von Industriegasen";4;"C2011";"C 20.11";"Herstellung von Industriegasen";""
5;"C20120";"C 20.12-0";"Herstellung von Farbstoffen und Pigmenten";4;"C2012";"C 20.12";"Herstellung von Farbstoffen und Pigmenten";""
5;"C20130";"C 20.13-0";"Herstellung von sonstigen anorganischen Grundstoffen und Chemikalien";4;"C2013";"C 20.13";"Herstellung von sonstigen anorganischen Grundstoffen und Chemikalien";""
5;"C20140";"C 20.14-0";"Herstellung von sonstigen organischen Grundstoffen und Chemikalien";4;"C2014";"C 20.14";"Herstellung von sonstigen organischen Grundstoffen und Chemikalien";""
5;"C20150";"C 20.15-0";"Herstellung von Düngemitteln und Stickstoffverbindungen";4;"C2015";"C 20.15";"Herstellung von Düngemitteln und Stickstoffverbindungen";""
5;"C20160";"C 20.16-0";"Herstellung von Kunststoffen in Primärformen";4;"C2016";"C 20.16";"Herstellung von Kunststoffen in Primärformen";""
5;"C20170";"C 20.17-0";"Herstellung von synthetischem Kautschuk in Primärformen";4;"C2017";"C 20.17";"Herstellung von synthetischem Kautschuk in Primärformen";""
5;"C20200";"C 20.20-0";"Herstellung von Schädlingsbekämpfungs-, Pflanzenschutz- und Desinfektionsmitteln";4;"C2020";"C 20.20";"Herstellung von Schädlingsbekämpfungs-, Pflanzenschutz- und Desinfektionsmitteln";""
5;"C20300";"C 20.30-0";"Herstellung von Anstrichmitteln, Druckfarben und Kitten";4;"C2030";"C 20.30";"Herstellung von Anstrichmitteln, Druckfarben und Kitten";""
5;"C20410";"C 20.41-0";"Herstellung von Seifen, Wasch-, Reinigungs- und Poliermitteln";4;"C2041";"C 20.41";"Herstellung von Seifen, Wasch-, Reinigungs- und Poliermitteln";""
5;"C20420";"C 20.42-0";"Herstellung von Körperpflegemitteln und Duftstoffen";4;"C2042";"C 20.42";"Herstellung von Körperpflegemitteln und Duftstoffen";""
5;"C20510";"C 20.51-0";"Herstellung von flüssigen Biokraftstoffen";4;"C2051";"C 20.51";"Herstellung von flüssigen Biokraftstoffen";""
5;"C20590";"C 20.59-0";"Herstellung von sonstigen chemischen Erzeugnissen a.n.g.";4;"C2059";"C 20.59";"Herstellung von sonstigen chemischen Erzeugnissen a. n. g.";""
5;"C20600";"C 20.60-0";"Herstellung von Chemiefasern";4;"C2060";"C 20.60";"Herstellung von Chemiefasern";""
5;"C21100";"C 21.10-0";"Herstellung von pharmazeutischen Grundstoffen";4;"C2110";"C 21.10";"Herstellung von pharmazeutischen Grundstoffen";""
5;"C21200";"C 21.20-0";"Herstellung von pharmazeutischen Spezialitäten und sonstigen pharmazeutischen Erzeugnissen";4;"C2120";"C 21.20";"Herstellung von pharmazeutischen Spezialitäten und sonstigen pharmazeutischen Erzeugnissen";""
5;"C22110";"C 22.11-0";"Herstellung und Runderneuerung von Bereifungen";4;"C2211";"C 22.11";"Herstellung und Runderneuerung von Bereifungen";""
5;"C22120";"C 22.12-0";"Herstellung von sonstigen Gummiwaren";4;"C2212";"C 22.12";"Herstellung von sonstigen Gummiwaren";""
5;"C22210";"C 22.21-0";"Herstellung von Platten, Folien, Schläuchen und Profilen aus Kunststoffen";4;"C2221";"C 22.21";"Herstellung von Platten, Folien, Schläuchen und Profilen aus Kunststoffen";""
5;"C22220";"C 22.22-0";"Herstellung von Verpackungsmitteln aus Kunststoffen";4;"C2222";"C 22.22";"Herstellung von Verpackungsmitteln aus Kunststoffen";""
5;"C22230";"C 22.23-0";"Herstellung von Türen und Fenstern aus Kunststoffen";4;"C2223";"C 22.23";"Herstellung von Türen und Fenstern aus Kunststoffen";""
5;"C22240";"C 22.24-0";"Herstellung von Baubedarfsartikeln aus Kunststoffen";4;"C2224";"C 22.24";"Herstellung von Baubedarfsartikeln aus Kunststoffen";""
5;"C22250";"C 22.25-0";"Bearbeitung und Veredlung von Kunststoffwaren";4;"C2225";"C 22.25";"Bearbeitung und Veredlung von Kunststoffwaren";""
5;"C22260";"C 22.26-0";"Herstellung von sonstigen Kunststoffwaren";4;"C2226";"C 22.26";"Herstellung von sonstigen Kunststoffwaren";""
5;"C23110";"C 23.11-0";"Herstellung von Flachglas";4;"C2311";"C 23.11";"Herstellung von Flachglas";""
5;"C23120";"C 23.12-0";"Veredlung und Bearbeitung von Flachglas";4;"C2312";"C 23.12";"Veredlung und Bearbeitung von Flachglas";""
5;"C23130";"C 23.13-0";"Herstellung von Hohlglas";4;"C2313";"C 23.13";"Herstellung von Hohlglas";""
5;"C23140";"C 23.14-0";"Herstellung von Glasfasern und Waren daraus";4;"C2314";"C 23.14";"Herstellung von Glasfasern und Waren daraus";""
5;"C23150";"C 23.15-0";"Herstellung, Veredlung und Bearbeitung von sonstigem Glas einschließlich technischen Glaswaren";4;"C2315";"C 23.15";"Herstellung, Veredlung und Bearbeitung von sonstigem Glas einschließlich technischen Glaswaren";""
5;"C23200";"C 23.20-0";"Herstellung von feuerfesten keramischen Werkstoffen und Waren";4;"C2320";"C 23.20";"Herstellung von feuerfesten keramischen Werkstoffen und Waren";""
5;"C23310";"C 23.31-0";"Herstellung von keramischen Wand- und Bodenfliesen und -platten";4;"C2331";"C 23.31";"Herstellung von keramischen Wand- und Bodenfliesen und -platten";""
5;"C23320";"C 23.32-0";"Herstellung von Ziegeln und sonstiger Baukeramik";4;"C2332";"C 23.32";"Herstellung von Ziegeln und sonstiger Baukeramik";""
5;"C23410";"C 23.41-0";"Herstellung von keramischen Haushaltswaren und Ziergegenständen";4;"C2341";"C 23.41";"Herstellung von keramischen Haushaltswaren und Ziergegenständen";""
5;"C23420";"C 23.42-0";"Herstellung von Sanitärkeramik";4;"C2342";"C 23.42";"Herstellung von Sanitärkeramik";""
5;"C23430";"C 23.43-0";"Herstellung von Isolatoren und Isolierteilen aus Keramik";4;"C2343";"C 23.43";"Herstellung von Isolatoren und Isolierteilen aus Keramik";""
5;"C23440";"C 23.44-0";"Herstellung von keramischen Erzeugnissen für sonstige technische Zwecke";4;"C2344";"C 23.44";"Herstellung von keramischen Erzeugnissen für sonstige technische Zwecke";""
5;"C23450";"C 23.45-0";"Herstellung von sonstigen keramischen Erzeugnissen";4;"C2345";"C 23.45";"Herstellung von sonstigen keramischen Erzeugnissen";""
5;"C23510";"C 23.51-0";"Herstellung von Zement";4;"C2351";"C 23.51";"Herstellung von Zement";""
5;"C23520";"C 23.52-0";"Herstellung von Kalk und gebranntem Gips";4;"C2352";"C 23.52";"Herstellung von Kalk und gebranntem Gips";""
5;"C23610";"C 23.61-0";"Herstellung von Erzeugnissen aus Beton, Zement und Kalksandstein für den Bau";4;"C2361";"C 23.61";"Herstellung von Erzeugnissen aus Beton, Zement und Kalksandstein für den Bau";""
5;"C23620";"C 23.62-0";"Herstellung von Gipserzeugnissen für den Bau";4;"C2362";"C 23.62";"Herstellung von Gipserzeugnissen für den Bau";""
5;"C23630";"C 23.63-0";"Herstellung von Frischbeton, Transportbeton";4;"C2363";"C 23.63";"Herstellung von Frischbeton, Transportbeton";""
5;"C23640";"C 23.64-0";"Herstellung von Mörtel und sonstigem Beton, ohne Frischbeton";4;"C2364";"C 23.64";"Herstellung von Mörtel und sonstigem Beton, ohne Frischbeton";""
5;"C23650";"C 23.65-0";"Herstellung von Faserzementwaren";4;"C2365";"C 23.65";"Herstellung von Faserzementwaren";""
5;"C23660";"C 23.66-0";"Herstellung von sonstigen Erzeugnissen aus Beton, Zement und Gips";4;"C2366";"C 23.66";"Herstellung von sonstigen Erzeugnissen aus Beton, Zement und Gips";""
5;"C23700";"C 23.70-0";"Be- und Verarbeitung von Naturwerksteinen und Natursteinen a.n.g.";4;"C2370";"C 23.70";"Be- und Verarbeitung von Naturwerksteinen und Natursteinen";""
5;"C23910";"C 23.91-0";"Herstellung von Schleifkörpern und Schleifmitteln auf Unterlage";4;"C2391";"C 23.91";"Herstellung von Schleifkörpern und Schleifmitteln auf Unterlage";""
5;"C23990";"C 23.99-0";"Herstellung von sonstigen Erzeugnissen aus nicht metallischen Mineralien a.n.g.";4;"C2399";"C 23.99";"Herstellung von sonstigen Erzeugnissen aus nichtmetallischen Mineralien a. n. g.";""
5;"C24100";"C 24.10-0";"Erzeugung von Roheisen, Stahl und Ferrolegierungen";4;"C2410";"C 24.10";"Erzeugung von Roheisen, Stahl und Ferrolegierungen";""
5;"C24200";"C 24.20-0";"Herstellung von Stahlrohren, Rohrform-, Rohrverschluss- und Rohrverbindungsstücken aus Stahl";4;"C2420";"C 24.20";"Herstellung von Stahlrohren, Rohrform-, Rohrverschluss- und Rohrverbindungsstücken aus Stahl";""
